Titles,Descriptions,Label
Revolutionizing How Users Experience Transportation Management: Shipwell Integrates AI-Language Model ChatGPT into its TMS Platform,"Shipwell, the leading transportation management platform, announced today that it has integrated the advanced AI language model ChatGPT into its Transportation Management System (TMS) platform, becoming the first in the",1
"Sam Altman didn't take any equity in OpenAI, report says","OpenAI co-founder and CEO Sam Altman didn't take an equity stake in the company when it added the for-profit OpenAI LP entity in 2019, according to Semafor.",0
FiscalNote Selected by OpenAI for Collaboration As Inaugural Launch Partner for OpenAI&#39;s ChatGPT Plug-in,"As OpenAI&#39;s Only Launch Partner in the Legal, Political, and Regulatory Domain, FiscalNote Extends its Leadership in the Application of AI to Laws and Regulations FiscalNote Holdings, Inc. (NYSE:NOTE)",1
OpenAI CEO admits a bug allowed some ChatGPT users to see others' conversation titles,OpenAI CEO Sam Altman says the company fixed a vulnerability that meant some users were able to see the titles of chats from other users.,0
ChatGPT-owner OpenAI fixes 'significant issue' exposing user chat titles,"ChatGPT-owner OpenAI said on Wednesday it had fixed a bug that caused a ""significant issue"" of a small set of users being able to see the titles of others' conversation history with the viral chatbot.",1
Contentstack Adds OpenAI ChatGPT Integration to its Industry-Leading Composable Digital Experience Platform,"New embedded AI Assistant allows teams to create brand-specific content in seconds, transforming content creation and publishing experiences News Summary: Contentstack announces OpenAI ChatGPT integration for its",1
OpenAI CEO Sam Altman says he's a 'little bit scared' of A.I.,"OpenAI CEO Sam Altman said he's a ""little bit scared"" of technology such as OpenAI's ChatGPT, in an interview with ABC News.",0
Pyramid Analytics expands AI-driven Decision Intelligence with new OpenAI integration,"The #1 ranked augmented analytics Decision Intelligence Platform adds deep integration of OpenAI into its 2023 release Pyramid Analytics (Pyramid), a leading business analytics and decision intelligence provider,",1
Italian minister says country's ban on ChatGPT is excessive,"Italy's deputy prime minister on Sunday criticised a decision by the government's Data Protection Authority to temporarily ban chatbot ChatGPT, saying the block over privacy concerns seemed excessive.",1
"Italy curbs ChatGPT, starts probe over privacy concerns",OpenAI has taken ChatGPT offline in Italy after the government's Data Protection Authority on Friday temporarily banned the chatbot and launched a probe over the artificial intelligence application's suspected breach of privacy rules.,0
Why We Need to Ban ChatGPT in Elementary Schools,"An Interview with Best-Selling Author and Educational Innovator, Mindy Bingham SANTA BARBARA, Calif., March 31, 2023 /PRNewswire/ -- The use of artificial intelligence such as ChatGPT and Bard has sparked concerns about",0
ChatGPT Banned in Italy Over Data-Privacy Concerns,"Italy’s regulator ordered a temporary ban on OpenAI’s ChatGPT, saying the chatbot has improperly collected and stored information, accelerating the rush by policy makers to roll out new rules for artificial intelligence.",0
Wondershare Filmora 12 Integrated ChatGPT to Offer Swift Script Feature with AI Copywriting,"VANCOUVER, BC, March 31, 2023 /PRNewswire/ -- Wondershare Filmora, a leading video editing software, has integrated ChatGPT, a plug-in that generates relevant text for video scripts, captions, and descriptions. This new",1
Italy data protection agency opens ChatGPT probe on privacy concerns,Italy's data protection agency said on Friday it had opened a probe into OpenAI's ChatGPT chatbot over a suspected breach of data collection rules.,0
Avochato Announces Integration with ChatGPT-4 by OpenAI,"SMS and WhatsApp Conversations Enhanced by AI-Powered Technology Avochato, a leading provider of advanced messaging software for businesses, has announced an integration with ChatGPT-4, the latest generation of",1
Italy Privacy Regulator Opens Probe on OpenAI Over ChatGPT,Italian privacy regulators said Friday that they launched a probe on OpenAI Inc. concerning its ChatGPT tool and techniques used to gather users’ personal data.,0
OpenAI faces complaint to FTC that seeks investigation and suspension of ChatGPT releases,The Center for AI and Digital Policy accuses OpenAI of violating a part of the FTC Act that prohibits unfair and deceptive business practices.,0
U.S. advocacy group asks FTC to stop new OpenAI GPT releases,"The tech ethics group Center for Artificial Intelligence and Digital Policy is asking the U.S. Federal Trade Commission to stop OpenAI from issuing new commercial releases of GPT-4, which has wowed some users and caused distress for others with its quick and human-like responses to queries.",0
OpenAI Target of Complaint to FTC Urging Halt of GPT Rollouts,A prominent tech ethics group plans to file a complaint with the US Federal Trade Commission urging the regulator to halt further commercial deployment of new generations of artificial intelligence technology that powers the popular OpenAI Inc. tool ChatGPT.,0
EY announces modernization of payroll employee care using ChatGPT In Azure OpenAI,Leverages ChatGPT In Azure OpenAI service to build proof of concept in collaboration with Microsoft to scale an enterprise-ready payroll chatbot to answer complex questions from employeesUses an underlying large language,1
NOLEJ and OpenAI Collaborate to Power the Future of Learning,"NEW YORK, March 29, 2023 /PRNewswire/ -- NOLEJ, the generative AI edtech start-up has announced a strategic collaboration with OpenAI, the AI research and deployment company behind GPT-4, GPT-3.5, ChatGPT, DALL·E, Codex",1
What's better than OpenAI? Developers shop for alternatives,Microsoft-backed OpenAI is no longer the only game in town for software developers looking to capitalize on an expected $90 billion market for artificial intelligence.,2
Alibaba Touts ChatGPT Challenger Ahead of Main Event,"Alibaba Group Holding Ltd. is inviting users to test the company’s in-house artificial intelligence tool, the latest attempt from a Chinese tech behemoth to rival OpenAI’s powerful ChatGPT.",2
Furwee - The World&#39;s First ChatGPT Conversational Character for Kids from Animatic Media,"Animatic Media is thrilled to announce the world&#39;s first ChatGPT conversational partner for kids: Furwee.ai. With Furwee, children can now engage in real-time conversations with an AI-powered animated character",1
ChatGPT maker to propose remedies over Italian ban,"ChatGPT producer OpenAI plans to present measures on Thursday to remedy concerns that led to an Italian ban on the chatbot last week, Italy's data protection agency Garante said.",1
ChatGPT LSAT Score Falls Short of Getting Into Top Law Schools,"Leading LSAT test prep provider Blueprint Prep analyzed the chatbot&#39;s results, finding that ChatGPT would fail to attain the needed scores without a veteran instructor and proven study strategies. LOS ANGELES, April",0
15 Videos of ChatGPT Testimonials of Killer Use Cases Published,"Users Are Not Slowed by Concerns of Bias or AI Taking Over The World ChatGPT Has Moved From a Novelty Item to an Indispensable Tool BOSTON, April 05, 2023 (GLOBE NEWSWIRE) -- ChatGPTnuggets, an AI",1
Coosto predicts their ChatGPT integration will create 90% of all social posts,"Coosto launches an integration with ChatGPT today and expects 90% of all social media posts from Coosto users to be created using this AI integration. EINDHOVEN, Netherlands, April 5, 2023 /CNW/ -- Coosto today",1
Microsoft's $13 billion bet on OpenAI carries huge potential along with plenty of uncertainty,"Microsoft's partnership with OpenAI could mean billions of dollars a year in new revenue, but the investment structure is complicated.",1
OpenAI to propose remedies to Italian ban on ChatGPT,"OpenAI plans to present measures to Italy's authorities on Thursday to remedy concerns that led to a ban last week on the ChatGPT chatbot in the country, Italy's Data Protection Authority said.",2
OpenAI and Italy's Data Protection Authority to hold meeting on Wednesday,"Italy's Data Protection Authority said on Tuesday that it would hold a meeting with representatives of OpenAI on Wednesday evening, after the authority temporarily banned the ChatGPT chatbot.",2
European privacy watchdog creates ChatGPT task force,"The body that unites Europe's national privacy watchdogs said on Thursday it had set up a task force on ChatGPT, a potentially important first step toward a common policy on setting privacy rules on artificial intelligence.",2
European Data Protection Board creates ChatGPT task force,"The European Data Protection Board (EDPB) on Thursday moved to create a task force on ChatGPT, the agency said in a statement.",2
ChatGPT can resume in Italy if meets data watchdog's demands,Italy's data protection agency set out a list of demands on Wednesday which it said OpenAI must meet by April 30 to address the agency's concerns over the ChatGPT chatbot and allow the artificial intelligence service to resume in the country.,0
"ChatGPT may be able to predict stock movements, finance professor says","Alejandro Lopez-Lira, a finance professor at the University of Florida, used ChatGPT to parse news headlines for whether they're good or bad for a stock. ",1
Warren Buffett says he doesn't understand A.I. but he asked ChatGPT to write a song in Spanish,"Warren Buffett said he has no expertise in artificial intelligence whatsoever, but thanks to Bill Gates, he took a crack at the buzzy chatbot ChatGPT.",2
Elon Musk plans AI startup to rival OpenAI - FT,"Billionaire Elon Musk is working on launching an artificial intelligence start-up that will rival ChatGPT-maker OpenAI, the Financial Times reported on Friday citing people familiar with his plans.",0
"Elon Musk Is Planning Startup That Will Rival OpenAI, FT Says","Elon Musk is making plans for an artificial intelligence startup that will rival OpenAI, according to the Financial Times, which said the billionaire is assembling a team of researchers and engineers to work on the project.",0
Distyl AI Forms Services Alliance with OpenAI and Raises $7M to Help Enterprises Tap Into the Potential of Generative AI and Large Language Models,"Services Alliance Announced with OpenAI to Bring Cutting-edge AI innovation and Infrastructure to Enterprises First Institutional Investment in the Company Led by Coatue and Dell Technologies Capital, with",1
Italy sets end-April deadline for OpenAI to meet demands on ChatGPT,Italy's data protection agency on Wednesday set an end-April deadline for OpenAI to meet its demands on data protection and privacy in order for its artificial intelligence ChatGPT chatbot service to be resumed in the country.,0
Italy to lift curbs on ChatGPT if OpenAI meets demands by end-April - data protection agency,Italy's data protection agency on Wednesday set an end-April deadline for OpenAI to meet its demands on data protection and privacy in order for the service to be resumed in the country.,0
"OpenAI to offer users up to $20,000 for reporting bugs","OpenAI, the firm behind chatbot sensation ChatGPT, said on Tuesday that it would offer up to $20,000 to users reporting vulnerabilities in its artificial intelligence systems.",1
OpenAI Will Pay People to Report Vulnerabilities in ChatGPT,"OpenAI will start paying people as much as $20,000 to help the company find bugs in its artificial intelligence systems, such as the massively popular ChatGPT chatbot.",1
OpenAI CEO considers opening office as Japan government eyes adoption,OpenAI Chief Executive Sam Altman said on Monday he is considering opening an office and expanding services in Japan after a meeting with Japan's prime minister.,1
Alphabet’s Search Dominance Feels Heat From ChatGPT,"As the dominant force in online search, Alphabet Inc.’s Google has for years had little to challenge its supremacy. But the rapid adoption of OpenAI’s ChatGPT has some investors concerned that may be about to change.",1
"ChatGPT won't take over from humans for now, says founder of Indian tech giant ","Nothing can beat the human mind — not even AI-powered chatbots like ChatGPT, says Narayana Murthy, the founder of Infosys.",0
Next Introduces ChatGPT Visibility and Adaptive Controls to Reveal Platform for Data Loss Prevention,"Addressing Data Protection Challenges in the Age of Generative AI-Powered Language Models Next DLP (&#34;Next&#34;), a leader in data protection, today announced the addition of ChatGPT policy templates to the",2
"Stability AI Launches ChatGPT Rival, With Some Kinks to Work Out","Artificial intelligence startup Stability AI Ltd. has released a language model called StableLM, the early version of an artificial intelligence tool that could power a chatbot along the lines of OpenAI’s ChatGPT.",0
Japan's Kishida says ChatGPT will be on G7 summit agenda -Kyodo,"Leaders from the Group of Seven advanced economies will discuss generative artificial intelligence ChatGPT when they gather in Hiroshima next month for a summit, Kyodo news agency quoted Japanese Prime Minister Fumio Kishida as saying on Wednesday.",1
"Exclusive: German authors, performers call for tougher ChatGPT rules amid copyright concerns","Forty-two German associations and trade unions representing more than 140,000 authors and performers on Wednesday urged the European Union to beef up draft artificial intelligence rules as they singled out the threat to their copyright from ChatGPT.",0
FiscalNote&#39;s VoterVoice Launches Enhanced AI Functionality and Integrations With OpenAI&#39;s ChatGPT to Revolutionize Use of AI in Lobbying and Advocacy Industry,"FiscalNote&#39;s VoterVoice Cloud-Based Advocacy Platform is the First to Incorporate Both Proprietary, Patented AI and ChatGPT into its Software - Driving Even More Value and Results for Customers FiscalNote Holdings,",1
"ChatGPT Buzz Fuels Demand for Chips and Gear, Advantest Says","Advantest Corp. is seeing a spike in demand for its chip-testing devices, catalyzed by the frenzy of interest in OpenAI’s ChatGPT and other novel uses of artificial intelligence.",1
"With OpenAI Integration, Bloomreach Content Enables AI-Powered Text Generation, Proofreading, and More Across E-Commerce Sites","MOUNTAIN VIEW, Calif., April 19, 2023 /PRNewswire/ -- Bloomreach, the world&#39;s #1 Commerce Experience Cloud, today announced an integration of OpenAI with Bloomreach Content, the company&#39;s headless content",1
Italy to allow ChatGPT to return if OpenAI takes 'useful steps',"Italy's data protection watchdog is ready to allow the return of the ChatGPT chatbot at the end of April if its maker OpenAI takes ""useful steps"" to address the agency's concerns, the authority's chief Pasquale Stanzione said in an interview published on Tuesday.",0
Italy's data watchdog: ChatGPt can resume on April 30 if OpenAI takes 'useful steps',"Italy's data protection watchdog is ready to reactivate the ChatGPT chatbot on April 30 if its maker OpenAI takes ""useful steps"" to address the agency's concerns, its chief Pasquale Stanzione said in an interview on Tuesday.",0
Exclusive: Behind EU lawmakers' challenge to rein in ChatGPT and generative AI,"As recently as February, generative AI did not feature prominently in EU lawmakers' plans for regulating artificial intelligence technologies such as ChatGPT.",0
Behind EU lawmakers' challenge to rein in ChatGPT and generative AI,"As recently as February, generative AI did not feature prominently in EU lawmakers' plans for regulating artificial intelligence technologies such as ChatGPT.",0
"UPDATE 1-ChatGPT is available again to users in Italy, spokesperson says","Access to the ChatGPT chatbot has been restored in Italy after its maker OpenAI ""addressed or clarified"" issues raised by Italy's data protection authority, an OpenAI spokesperson said on Friday.",1
"ChatGPT is available again to users in Italy, spokesperson says","OpenAI's ChatGPT chatbot will be available again to users in Italy, a company spokesperson confirmed in a statement to Reuters.",1
ChatGPT Will See You Now: Doctors Using AI to Answer Patient Questions,"ChatGPT is better than doctors at responding to patient questions posted online, study says.  ",1
Dr. ChatGPT? Physicians Are Sending Patients Advice Using AI,"ChatGPT is better than doctors at responding to patient questions, study says ",1
INSEAD develops poetic generative AI applications rivalling ChatGPT - more to come,"FONTAINEBLEAU, France, SINGAPORE and SAN FRANCISCO, April 28, 2023 /PRNewswire/ -- Despite its popularity, ChatGPT has been criticised for generating unreliable and biased search results. A recent media report, for",0
OpenAI closes $300 mln funding round at $27 bln-$29 bln valuation - TechCrunch,"OpenAI, the company behind the ChatGPT chatbot, has closed a more than $300 million share sale at a valuation between $27 billion and $29 billion, TechCrunch reported on Friday.",1
OpenAI closes $10 bln funding round at $27 bln-$29 bln valuation- TechCrunch,"OpenAI, the company behind the ChatGPT chatbot, has closed a new funding round of over $10.3 billion, valuing the company between $27 billion – $29 billion, TechCrunch reported on Friday.",1
"OpenAI Restores ChatGPT in Italy, Addresses Regulator Demands",OpenAI restored access to its ChatGPT chatbot for Italian users after the artificial intelligence researcher said it has addressed concerns raised in March by that country’s privacy regulator.,1
The ODP Corporation Expands Collaboration with Microsoft to Leverage the Power of AI Technology from Microsoft Azure OpenAI Service,"ODP&#39;s collaboration with Microsoft to include Microsoft Azure OpenAI Service to enhance customer experience, drive additional operational efficiencies, and create a sustainable competitive advantage The ODP",1
"ChatGPT users can now turn off their chat history, OpenAI announces",OpenAI announces new controls that allow ChatGPT users to turn off chat history,2
OpenAI rolls out 'incognito mode' on ChatGPT,"OpenAI is introducing what one employee called an ""incognito mode"" for its hit chatbot ChatGPT that does not save users’ conversation history or use it to improve its artificial intelligence, the company said Tuesday.",2
"Appy Pie Revolutionizes Chatbot Technology with Integration of Advanced LLMs including ChatGPT-4, StableLM Alpha, LLaMA, and Dolly","Appy Pie&#39;s AI Chatbot Builder now supports cutting-edge language models like ChatGPT-4, StableLM Alpha, LLaMA, and Dolly, enabling businesses to create highly sophisticated chatbots for improved customer",2
Iflytek Unveils ChatGPT Rival Amid China Oversight,"Chinese voice-recognition company Iflytek Co. has entered the race to build a rival to OpenAI Inc.’s ChatGPT, with a live demonstration of its artificial intelligence model for educational and enterprise uses, even as Beijing signaled more oversight of the industry.",0
CAST Imaging integrates ChatGPT to help companies accelerate software development,"NEW YORK and PARIS, May 04, 2023 (GLOBE NEWSWIRE) -- CAST, the software intelligence leader, has announced that ChatGPT integration is available to all users of its CAST Imaging product. While navigating the internal",2
Redfin Launches ChatGPT Plugin to Help People Find Their Next Home,"People can use the Redfin ChatGPT plugin to describe their home search in everyday terms and find homes they might have missed using a map-based search. (NASDAQ:RDFN) — Redfin (redfin.com), the technology-powered real",2
Plexamp adds &#34;Sonic Sage&#34; ChatGPT-based feature for creating incredible playlists,"Music lovers now have an amazing new way to find and play music they&#39;ll love in any moment LOS ANGELES, May 3, 2023 /PRNewswire/ -- Plex music player Plexamp today released Sonic Sage, its new ChatGPT in-app",2
Meta says ChatGPT-related malware is on the rise,"Facebook owner Meta said on Wednesday it had uncovered malware purveyors leveraging public interest in ChatGPT to lure users into downloading malicious apps and browser extensions, likening the phenomenon to cryptocurrency scams.",0
Zillow builds ChatGPT plugin for real estate searches,"Zillow®, the most visited real estate website in the U.S., has developed a new ChatGPT plugin for real estate.With a new ChatGPT plugin, Zillow is testing more ways for customers to find and get into their next",2
MosaicML launches new service in bid to challenge OpenAI on price,"MosaicML, an artificial intelligence startup founded by former Intel Corp executives and academic researchers, released on Wednesday two new products aimed at beating industry giants such as OpenAI on price.",0
"Kamala Harris to discuss A.I. in meeting with Google, Microsoft, OpenAI and Anthropic CEOs","Kamala Harris will meet with Google, Microsoft, OpenAI and Anthropic CEOs to discuss AI",2
"Google, Microsoft OpenAI CEOs to attend White House AI meeting -official","The chief executives of Alphabet Inc's Google , Microsoft , OpenAI and Anthropic will attend a White House meeting Thursday with Vice President Kamala Harris and other administration officials on key artificial intelligence issues, a White House official told Reuters.",2
Revolutionizing Influencer Marketing: How ChatGPT is Changing the Landscape,"NEW YORK, May 11, 2023 /PRNewswire/ -- Upfluence, the leading influencer marketing software, has announced a game-changing new integration with ChatGPT, the AI-powered language model, that is set to revolutionize",1
Revolutionizing Gift-Giving With Giftwrap.ai&#39;s ChatGPT Plugin,"Giftwrap.ai is a gifting marketplace that leverages AI to provide personalized gift recommendationsGiftwrap.ai has launched the very first gifting plugin, allowing ChatGPT users to send gifts with a single promptLOS",2
Noteable Launches ChatGPT Plugin Revolutionizing Access to Data Analysis Regardless of Technical Ability,"With the Noteable Notebooks ChatGPT plugin, users of any technical ability can now generate fully computational and interactive notebooks with a single prompt SAN FRANCISCO, May 11, 2023 /PRNewswire/ -- Today,",2
ChatGPT Faces More Scrutiny From EU Lawmakers in AI Proposal,OpenAI’s ChatGPT and Google’s Bard may be asked to follow stricter rules to operate in the European Union after the bloc took a step toward new regulations for artificial intelligence.,0
Japan AI Stocks Surge After SoftBank Joins ChatGPT Clone Race,"SoftBank Group Corp.’s mobile unit has declared it’s joining a global race to build a version of ChatGPT, sending a clutch of AI-related Japanese companies surging Thursday.",0
"Early MIT research shows 'Industrial Revolution-level large' leap for workers using ChatGPT, generative AI","New MIT research shows ChatGPT creating gains at work that rival the Industrial Revolution and steam engine, says CEO of Google-linked AI startup Cohere.",1
Orion Advisor Technology Goes Live with Industry&#39;s First ChatGPT Integration,"Wealthtech disruptor launches first-of-its-kind ChatGPT integration to streamline client communications for advisors via Redtail Speak Orion Advisor Solutions, the premier provider of transformative wealthtech",1
OpenAI CEO to testify in US Senate next week amid questions about technology,OpenAI CEO Sam Altman will make his first appearance before a Senate panel next week as the U.S. Congress grapples with how best to regulate artificial intelligence as the technology becomes more powerful and widespread.,2
Why ChatGPT developer OpenAI is the No. 1 company on the 2023 CNBC Disruptor 50 list,ChatGPT maker OpenAI is the No. 1 CNBC 2023 Disruptor 50 company as the Microsoft-backed AI startup leads the biggest tech breakthrough since the iPhone.,1
NeaChat Uses OpenAI ChatGPT Version 4 Offering Chinese Users a Cutting-Edge AI Technology Experience,"Wuhan, China , May 06, 2023 (GLOBE NEWSWIRE) -- The NeaChat team is honored to announce that it has obtained access to OpenAI&#39;s latest generation of artificial intelligence language model GPT-4, becoming one of the",2
Apple restricts use of OpenAI's ChatGPT for employees -WSJ,"Apple Inc has restricted the use of ChatGPT and other external artificial intelligence tools for its employees as Apple develops similar technology, the Wall Street Journal reported on Thursday, citing a document and sources.",0
Apple restricts use of ChatGPT - WSJ,"Apple Inc has restricted the use of ChatGPT and other external artificial intelligence tools as it develops its own similar technology, the Wall Street Journal reported on Thursday.",0
NYC Public Schools Drop Ban on AI Tool ChatGPT,New York City public schools have lifted a ban on artificial intelligence tool ChatGPT after initially banning the software in January over safety and accuracy concerns.,1
NetBase Quid&#39;s ChatGPT-enabled search capabilities save time and improve creativity for industry professionals,"SANTA CLARA, Calif., May 18, 2023 /PRNewswire/ -- NetBase Quid®, a global leader in AI-powered consumer and market intelligence, today announced ChatGPT-enabled search capabilities. The enhancement marks the first",1
BigOrange Marketing Discusses Best Practices for ChatGPT at National IT Conference,"StoryBrand Marketing professional chosen to speak at IT Nation three years in a row ChatGPT seems to be everywhere, but how can it be used best in marketing and creating content for IT services companies? That&#39;s the",2
OpenAI Brings ChatGPT App to iPhone; Android Launch Coming Later,"OpenAI Inc. is bringing its ChatGPT generative AI tool to smartphones for the first time, releasing an iPhone version on Thursday and promising a service for Android devices in the future.",1
