Titles,Descriptions,Label
"AI Art Site Uses ChatGPT Technology to Create Nearly 4,000 Unique Poems and Songs","SAN DIEGO, Jan. 5, 2023 /PRNewswire/ -- artAistry.com, an art website specializing in AI wall art, is setting a new standard for the creation of art with the help of ChatGPT technology. The site has now added nearly",1
UPDATE 2-ChatGPT creator OpenAI in talks for tender offer valuing company at $29 bln - WSJ,"OpenAI, the artificial intelligence research lab behind chatbot ChatGPT, is in talks to sell existing shares in a tender offer that would value the company at about $29 billion, the Wall Street Journal reported on Thursday, citing people familiar with the matter.",1
Got It AI Develops AI to Identify and Address ChatGPT Hallucinations for Enterprise Applications,"PALO ALTO, Calif., Jan. 13, 2023 (GLOBE NEWSWIRE) -- Got It AI, the Autonomous Conversational AI company, announced an innovative new &#34;Truth Checker&#34; AI that can identify when ChatGPT is hallucinating",0
Microsoft in talks to invest $10 billion in ChatGPT-owner OpenAI - Semafor,"(Reuters) -Microsoft Corp is in talks to invest $10 billion in ChatGPT-owner OpenAI as part of funding that will value the firm at $29 billion, Semafor reported on Monday, citing people familiar with the matter.",1
UPDATE 2-Microsoft in talks to invest $10 bln in ChatGPT-owner OpenAI - Semafor,"Microsoft Corp is in talks to invest $10 billion in ChatGPT-owner OpenAI as part of funding that will value the firm at $29 billion, Semafor reported on Monday, citing people familiar with the matter.",1
"Microsoft’s Investment in ChatGPT Poses Challenge for Google, Analysts Say","Microsoft is reportedly in talks over a further investment in OpenAI, the developer of ChatGPT. ",1
Microsoft reportedly plans to invest $10 billion in creator of buzzy A.I. tool ChatGPT,"A bet on ChatGPT could help Microsoft boost its efforts in web search, a market dominated by Google.",1
"Microsoft (MSFT) Might Invest $10B in ChatGPT Owner, OpenAI","Microsoft (MSFT) might invest as much as $10 billion in OpenAI, the creator of viral artificial intelligence bot ChatGPT, to develop consumer technology on Microsoft Cloud.",1
UPDATE 1-Microsoft in talks to invest $10 bln in ChatGPT owner -Semafor,"Microsoft Corp is in talks to invest $10 billion into OpenAI, the owner of ChatGPT, which will value the San Francisco-based firm at $29 billion, Semafor reported on Monday, citing people familiar with the matter.",1
Microsoft in talks to invest $10 billion in ChatGPT owner -Semafor,"Microsoft Corp is said to be in talks to invest $10 billion into OpenAI, the owner of ChatGPT, Semafor reported on Monday, citing people familiar with the matter.",1
"Microsoft’s Investment in OpenAI Poses Challenge for Google, Analysts Say","Microsoft is reportedly in talks over a further investment in OpenAI, the developer of ChatGPT. ",1
Microsoft to expand ChatGPT access as OpenAI investment rumors swirl,"Microsoft Corp on Monday said it is widening access to hugely popular software from OpenAI, a startup it is backing whose futuristic ChatGPT chatbot has captivated Silicon Valley.",1
Emplifi Launches AI Composer Using OpenAI&#39;s GPT-3 Framework to Generate Ready-to-Publish Social Media Copy for Businesses,"Brands increase operational efficiency, productivity and workforce optimization by leveraging OpenAI&#39;s GPT-3 language and learning models for automatic social media content generation. Emplifi, the leading unified",1
Top French university bans use of ChatGPT to prevent plagiarism,"Sciences Po, one of France's top universities, has banned the use of ChatGPT, an artificial intelligence-based chatbot that can generate coherent prose, to prevent fraud and plagiarism.",0
Microsoft Boosts Investment in ChatGPT Parent OpenAI,Microsoft's investment in artificial-intelligence software firm OpenAI is reportedly worth $10 billion over multiple years.,1
Microsoft announces multibillion-dollar investment in ChatGPT-maker OpenAI,"Microsoft announced a new multiyear, multibillion-dollar investment with the artificial intelligence lab OpenAI, according to a release Monday. ",1
UPDATE 1-Microsoft to invest more in OpenAI as tech race heats up,"Microsoft Corp said on Monday it would invest more in OpenAI, staking its future on the startup and tech behind the chatbot sensation ChatGPT, as well as setting the stage for more competition with its rival Alphabet Inc's Google.",1
Microsoft to invest more in OpenAI as arms race in tech heats up,"Microsoft Corp said on Monday it would invest more in OpenAI, staking its future on the startup and technology behind the chatbot sensation ChatGPT and setting the stage for more competition with its rival Alphabet Inc's Google.",1
ChatGPT ignited a new A.I. craze. What it means for tech companies and who's best positioned to benefit,"Since the launch of ChatGPT late last year, no one in the tech world can seem to stop talking about artificial intelligence. ",1
ChatGPT Plagiarism - New Tool Lets Teachers Know If AI Wrote a Student Essay,"A young and ambitious web developer&#39;s successful attempt at ensuring that student essays are &#39;Not Dead&#39; as claimed by proponents of ChatGPT. TORONTO, Feb. 3, 2023 /PRNewswire/ -- Tomer Tarsky, an AI",2
"EXCLUSIVE-EU's Breton warns of ChatGPT risks, AI rules seek to tackle concerns","EU industry chief Thierry Breton said new artificial intelligence rules will aim to tackle concerns about the risks of ChatGPT and ensure Europeans can trust artificial intelligence technology, the first comments by a senior EU official amid concerns about the chatbot from OpenAI",0
"ChatGPT May Already Be Used In Nation State Cyberattacks, Say IT Decision Makers in BlackBerry Global Research","51% of IT decision makers believe there will be a successful cyberattack credited to ChatGPT within the year 95% believe governments have a responsibility to regulate advanced technologies, such as ChatGPTWATERLOO, ON,",0
UPDATE 1-ChatGPT sets record for fastest-growing user base - analyst note,"ChatGPT, the popular chatbot from OpenAI, is estimated to have reached 100 million monthly active users in January, just two months after launch, making it the fastest-growing consumer application in history, according to a UBS study on Wednesday.",1
ChatGPT Launching Paid Subscription for AI Chatbot,"For $20 a month, ChatGPT Plus subscribers will get better access to ChatGPT, faster response times, and first dibs on new features and improvements. ",2
Microsoft rolls out ChatGPT-powered Teams Premium,Microsoft Corp on Wednesday rolled out a premium Teams messaging offering powered by ChatGPT to simplify meetings using the AI chatbot that has taken Silicon Valley by a storm.,1
ChatGPT Users Topped 100 Million in January. Investors Are Betting Big on AI.,"ChatGPT has reached the 100 million-user level faster than previous red-hot applications such as TikTok, according to UBS analyst Lloyd Walmsley.",1
OpenAI launches ChatGPT subscription plan for $20 per month,"ChatGPT owner OpenAI said on Wednesday it is launching a pilot subscription plan for its popular AI-powered chatbot, called ChatGPT Plus, for $20 per month.",1
OpenAI comes up with a way to check if text was written by a human or not,OpenAI acknowledges shortcomings in its tool for spotting synthetic text but says it's stronger at dealing with outputs from more recent AI models.,2
"OpenAI Generated NFTs Can Now Be Created by Hubspot, Google and Shopify Forms Thanks to idexo Product Release That Unlocks New Opportunities for Marketers","LONDON, Jan. 30, 2023 /PRNewswire/ -- idexo is pleased to announce the release of a new OpenAI integration through its existing integration with Zapier that enables any web form system to be used to create NFTs with the",2
"Appy Pie&#39;s Chatbot Builder is Now Powered by GPT-3, the Driving Force behind ChatGPT","HAMPTON, Va., Feb. 12, 2023 /PRNewswire/ -- Appy Pie Chatbot, a no-code chatbot building platform, is now powered by OpenAI&#39;s GPT-3 technology, the backbone of ChatGPT. GPT-3&#39;s incorporation into the Appy Pie",2
UPDATE 1-ChatGPT frenzy sweeps China as firms scramble for home-grown options,"Microsoft-backed OpenAI has kept its hit ChatGPT app off-limits to users in China, but the app is attracting huge interest in the country, with firms rushing to integrate the technology into their products and launch rival solutions.",1
"UPDATE 1-Hanwang, bellwether of Chinese ChatGPT frenzy, under regulatory scrutiny","The Shenzhen Stock Exchange said on Friday it had put Hanwang Technology Co Ltd, widely seen as a bellwether of Chinese ChatGPT-concept stocks, on its ""focus watch list"" following recent ""abnormal"" gains in its share price.",0
Bill Gates thinks A.I. like ChatGPT is the 'most important' innovation right now,"Microsoft co-founder Bill Gates thinks AI software like ChatGPT is the most important innovation right now, and could change healthcare and education for good.",1
JD.com Jumps on the ChatGPT Bandwagon. Why It Signals That AI Fever Is Cooling.,JD.com is just the latest tech giant—let alone a Chinese one—to announce plans for a ChatGPT-style AI tool. The stock market hasn't cheered.,2
CORRECTED-ChatGPT frenzy sweeps China as firms scramble for home-grown options,"Microsoft-backed OpenAI has kept its hit ChatGPT app off-limits to users in China but the app is attracting huge interest in the country, with firms rushing to integrate the technology into their products and launch rival solutions.",1
Chinese e-commerce giant JD.com to launch ChatGPT-style product,"JD.com said it will release an ""industrial version"" of ChatGPT called ChatJD. It will be a chatbot product focused on the fields of retail and finance.",2
Iris Dating Integrates ChatGPT AI Technology to Create Engaging and Authentic Profile Bios,"Iris Dating, the next-generation dating app that utilizes artificial intelligence to predict mutual attraction, announces the integration of ChatGPT into its platform. This integration will allow the app to generate",2
ConnectWise integrates with OpenAI to solve complex problems and save time for MSPs,"TAMPA, Fla., Feb. 09, 2023 (GLOBE NEWSWIRE) -- ConnectWise, the world&#39;s leading software company dedicated to the success of IT solution providers, today announced an integration with OpenAI&#39;s ChatGPT, the cutting-edge",1
"The AI State of the Union Experience: FiscalNote Combines Proprietary Datasets &amp; AI With OpenAI Platform to Transform Analysis of Presidential State of the Union Addresses, Building on Its Decade-Long Track Record of AI-Driven Solutions &amp; Expertise",FIscalNote Leverages OpenAI&#39;s GPT to Propose a Groundbreaking ‘AI State of the Union Address&#39; in Advance of President Biden&#39;s Speech Highly-Partisan Rhetoric in State of the Union Speeches is at Highest Level in Over,2
Bing Chat Is Far Better Than ChatGPT. Just Don’t Ask About Stocks.,Microsoft’s new Bing Chat is already making ChatGPT look old-fashioned. But the chatbot struggled to answer questions about the stock market.,2
"Bloomreach Launches AI Content Generation for Email, SMS, and Push Notifications with ChatGPT Integration","MOUNTAIN VIEW, Calif., Feb. 16, 2023 /PRNewswire/ -- Bloomreach, the world&#39;s #1 Commerce Experience Cloud, today announced the expansion of its AI/ML capabilities with the launch of a ChatGPT integration for",2
"Elon Musk, who co-founded firm behind ChatGPT, warns A.I. is 'one of the biggest risks' to civilization","ChatGPT ""has illustrated to people just how advanced AI has become,"" according to Musk.",0
Pop Culture Group announces subsidiary&#39;s plan to accelerate digitization through ChatGPT,"XIAMEN, China, Feb. 15, 2023 /PRNewswire/ -- Pop Culture Group (CPOP) announced today that its subsidiary, Shenzhen Pupu Digital Industry Development Cooperation, will dedicate itself to developing programs where ChatGPT",2
China's tech giants are launching ChatGPT clones — and Beijing is watching closely,Chinese technology giants from Alibaba to Baidu have announced their intentions to launch ChatGPT-style products.,2
UPDATE 1-Beijing to support key firms in building ChatGPT-like AI models,"China's capital Beijing will support leading enterprises in building large artificial intelligence (AI) models that can challenge ChatGPT, the city's economy and information technology bureau said on Monday.",1
CORRECTED-UPDATE 1-ChatGPT frenzy sweeps China as firms scramble for home-grown options,"Microsoft-backed OpenAI has kept its hit ChatGPT app off-limits to users in China, but the app is attracting huge interest in the country, with firms rushing to integrate the technology into their products and launch rival solutions.",1
CORRECTED-RPT-UPDATE 1-ChatGPT frenzy sweeps China as firms scramble for home-grown options,"Microsoft-backed OpenAI has kept its hit ChatGPT app off-limits to users in China, but the app is attracting huge interest in the country, with firms rushing to integrate the technology into their products and launch rival solutions.",1
"Creatd, Inc. Uses OpenAI Tools to Enhance Moderation, Curation, and Content Generation on its Flagship Product Vocal.","OpenAI expected to accelerate the Company&#39;s cash flow break even plans.Strategy includes automating methods for moderation, curation, and content creation.Future updates give the creator direct access to OpenAI tools",1
China says it sees the potential of ChatGPT-like technology,BEIJING (Reuters) -China's Ministry of Science and Technology said on Friday said it saw the potential of ChatGPT-like tech and would be pushing for the integration of artificial intelligence into Chinese society and the economy.,1
Birdeye Adds ChatGPT Model to its AI Platform,Local brands and businesses can now automate review and survey responses with AI OpenAI&#39;s ChatGPT has opened up a world of possibilities for digital customer experiences. Birdeye has created a new review and survey,1
Baidu’s ChatGPT-Style Bot Will Be No Magic Bullet,"The Chinese company is riding the chatbot wave higher, but whether its ChatGPT-like bot can recharge stagnant advertising revenue is an open question.",1
"Baidu's ChatGPT-like app will revolutionise its search engine, says CEO","China's Baidu Inc will use its ChatGPT-like app Ernie Bot to create a ""revolutionary"" version of its popular search engine, the company's CEO said on Wednesday.",1
JustAnswer Launches Easy Tool to Immediately Verify ChatGPT-Generated Responses Via a Vetted Human Expert,"New ChatGPT Verifier Site From Popular Expert Platform Offers Peace of Mind for Life&#39;s Critical Questions SAN FRANCISCO, Feb. 22, 2023 /PRNewswire/ -- Popular expert platform JustAnswer has launched a new tool that",2
Virtualspeech brings ChatGPT Conversational AI to VR Soft Skills Training,"LONDON, Feb. 21, 2023 /PRNewswire/ -- Virtualspeech, a leading provider of virtual reality training, has integrated ChatGPT, an AI language model, into its soft skills training. This integration will enhance realistic",1
FOCUS-ChatGPT launches boom in AI-written e-books on Amazon,"Until recently, Brett Schickler never imagined he could be a published author, though he had dreamed about it. But after learning about the ChatGPT artificial intelligence program, Schickler figured an opportunity had landed in his lap.",1
"AIZEN, the Banking Service with &#39;AI Core-Tech&#39; in a Dynamic Environment with ChatGPT","SEOUL, KOREA, Feb. 19, 2023 (GLOBE NEWSWIRE) -- Recently, AIZEN is proud to announce the banking service using &#34;AI Core-Tech&#34; in a dynamic environment with ChatGPT. Experts predict that the advent of ChatGPT",1
Bain &amp; Company announces services alliance with OpenAI to help enterprise clients identify and realize the full potential and maximum value of AI,Global partnership combines the power of OpenAI&#39;s industry-leading AI technology advancements with Bain&#39;s world-renowned capabilities in strategy and digital application delivery; The Coca-Cola Company announced,1
Stan Skrabut Announces the Release of Book 80 Ways to Use ChatGPT in the Classroom,"SMITHFIELD, R.I., March 03, 2023 (GLOBE NEWSWIRE) -- ChatGPT, the AI language model, has gained widespread popularity and is now being used in classrooms worldwide. Stan Skrabut, an instructional technologist, has",2
"Microsoft&#39;s Monetization Potential, Nvidia&#39;s Nascent Monetization And Investment In ChatGPT Make Them Analyst Top Picks","OpenAI&#39;s ChatGPT likely saw growth rates suggesting it is the fastest-growing tool and app in history, registering 100 million users by January 2023 after its launch in November 2022.",1
A South Korean telco giant has its own A.I. chatbot — and says it's a 'super app' version of ChatGPT,"SK Telecom is planning this year to fully launch ""A."", its artificial intelligence chatbot and its answer to OpenAI's ChatGPT.",2
5 Major Tech Players Competing With ChatGPT Technology,"Here we present five tech giants, BABA, BIDU, META, GOOGL and SNAP, which are set to compete with Microsoft-backed ChatGPT, an AI chatbot developed by OpenAI.",2
"The popularity of ChatGPT is a 'milestone' in establishing Qualcomm as an AI company, CEO says","The popularity of ChatGPT is a chance to show off the capabilities of artificial intelligence on smartphones, according to chip company Qualcomm's chief executive.",1
AlertEnterprise Looks to Transform Physical Security with Reveal of New Security AI Chatbot Powered by ChatGPT,"AlertEnterprise, Inc., the leading cyber-physical security convergence software company, today revealed the launch of its first-ever Guardian AI Chatbot powered by OpenAI ChatGPT. The company will debut the AI Chatbot",1
Elon Musk recruits team to develop OpenAI's ChatGPT rival - The Information,"(Reuters) -Elon Musk has approached AI researchers in recent weeks about forming a new research lab to develop an alternative to OpenAI's ChatGPT, the Information reported on Monday, citing people with direct knowledge of the effort.",1
UPDATE 1-Elon Musk recruits team to develop OpenAI's ChatGPT rival - The Information,"Elon Musk has approached AI researchers in recent weeks about forming a new research lab to develop an alternative to OpenAI's ChatGPT, the Information reported on Monday, citing people with direct knowledge of the effort.",1
Opera announces collaboration with OpenAI to realize AIGC Ambitions,"OSLO, Norway, Feb. 27, 2023 /PRNewswire/ -- Opera (NASDAQ:OPRA), one of the world&#39;s leading browser developers, announced today a collaboration with the leading artificial intelligence research laboratory OpenAI.",1
CORRECTED-GM explores using ChatGPT in vehicles,"General Motors Co is exploring uses for ChatGPT as part of its broader collaboration with Microsoft Corp, a company executive told Reuters last week.",1
DXcharts Integrates with ChatGPT to Provide Users with Essential Term Descriptions,"DXcharts, a financial charting library developed by Devexperts, has integrated with ChatGPT to provide end users with insights into core charting elements. This press release features multimedia. View the full release",1
Presto Collaborates With ChatGPT Creator OpenAI to Enhance its Industry-leading Drive-thru AI Voice Assistant,The ChatGPT API will be used to test the AI engine in Presto Voice and expand its already extensive feature set,1
ATPBOT Launches The ChatGPT of Quantitative Trading,"Singapore, Singapore , March 07, 2023 (GLOBE NEWSWIRE) -- ChatGPT has been a hot topic this year, for it&#39;s changing the way people live and work. Now ATPBOT launched the world&#39;s best AI-Quantitative trading",2
ChatGPT with Wonderful Platform&#39;s Seniorcare robot &#34;Avadin&#34;,"Amidst the growing interest in OpenAI&#39;s conversation artificial intelligence (AI) service ChatGPT and what it is capable of in the future, an AI specialist company named Wonderful Platform (CEO - Seung Yub, Koo),",1
ParkON Launches Scholarship to Explore ChatGPT and Travel,"As a leader in the airport parking space, ParkON launches its annual essay scholarship and this year, the topic is centered around ChatGPT. MIAMI, March 7, 2023 /PRNewswire/ -- ParkON is proud to announce a nationwide",1
Brazilian digital bank sees ChatGPT as an ally in the four-day week,"SÃO PAULO, March 7, 2023 /PRNewswire/ -- Since its launch, ChatGPT has attracted the attention of professionals from several fields. Efí, one of the major Brazilian fintechs, has gone further and started to use the",1
Generative AI Leader Forethought Announces SupportGPT™ Powered by OpenAI Technology,"Forethought, the leading generative AI for customer support automation, today announced the launch of SupportGPT™, the world&#39;s first generative AI platform for customer support. With the help of OpenAI&#39;s",2
Salesforce to add ChatGPT to Slack as part of OpenAI partnership,"Salesforce Inc said on Tuesday it was working with ChatGPT creator OpenAI to add the chatbot sensation to its collaboration software Slack, as well as bring generative artificial intelligence to its business software generally.",1
Oneflow leverages the latest OpenAI&#39;s GPT Turbo to forge the future of contracts,"STOCKHOLM, March 7, 2023 /PRNewswire/ -- Oneflow, a Stockholm-based SaaS company whose product is a contract automation platform, has released a brand new feature called AI Assist. AI Assist uses the latest OpenAI&#39;s",1
Baidu&#39;s ChatGPT Counterpart Ernie Bot Impresses Analysts,"Baidu, Inc shares saw redemption after brokerages, including Citigroup, granted their preliminary approval to its ChatGPT counterpart.",2
Microsoft to improve Office 365 with ChatGPT-like generative A.I. tech,Microsoft plans to improve its Office 365 suite of business software with ChatGPT-like generative A.I. tech.,1
Baidu shares drop to 8-week lows after company reveals ChatGPT rival,"Chinese tech company Baidu gave the public a peek Thursday at what its Chinese-language ChatGPT alternative can do, while warning of its imperfections.",1
UPDATE 2-China's answer to ChatGPT? Baidu shares tumble as it unveils Ernie Bot,"Chinese search engine giant Baidu on Thursday unveiled its much-anticipated artificial intelligence-powered chatbot known as Ernie Bot, giving the world a glimpse of what could be China's strongest rival to U.S. research lab OpenAI's ChatGPT.",1
Software AG launches webMethods.io ChatGPT API Connector to leverage Generative AI in core business systems,Organizations can enhance customer-facing processes and digital transformation initiatives Software AG (Frankfurt MDAX: SOW) has launched a new ChatGPT API Connector for its webMethods.io integration platform. This,1
"ChatGPT and Generative AI are booming, but at a very expensive price","It can cost millions of dollars to train and operate generative AI technologies like ChatGPT, which are being subsidized by tech companies and VCs.",1
Morgan Stanley Wealth Management Announces Key Milestone in Innovation Journey with OpenAI,Wealth Management division developing internal-facing service that leverages OpenAI technology and Morgan Stanley&#39;s vast intellectual capital to deliver relevant content and insights into the hands of Financial,1
UPDATE 1-Microsoft-backed OpenAI starts release of powerful AI known as GPT-4,"OpenAI, the creator of chatbot sensation ChatGPT, on Tuesday said it is beginning to release a powerful artificial intelligence model known as GPT-4, setting the stage for even more human-like technology to proliferate.",1
"Casetext&#39;s CoCounsel, the First AI Legal Assistant, Is Powered by OpenAI&#39;s GPT-4, the First Large Language Model to Pass Bar Exam","SAN FRANCISCO, March 14, 2023 /PRNewswire/ -- Legal AI company Casetext announced that its AI legal assistant, CoCounsel, is powered by GPT-4, the latest, most advanced large language model from OpenAI, released today.",1
"SWARM Engineering Announces AgriFood Virtual Advisor (AVA), Powered by OpenAI and Microsoft Azure","IRVINE, Calif., March 14, 2023 /PRNewswire/ -- SWARM Engineering is proud to announce AVA, the first AgriFood Virtual Advisor, an AI-powered digital assistant based on OpenAI, Microsoft Azure and SWARM technology,",1
"OpenAI announces smarter AI model called GPT-4, claims it does better on the SAT than 90% of test takers","GPT-4 performed at the 90th percentile on a simulated bar exam, the 93rd percentile on an SAT reading exam, and the 89th percentile on the SAT Math exam, OpenAI claimed. ",1
Be My Eyes Announces New Tool Powered by OpenAI&#39;s GPT-4 to Improve Accessibility for People Who are Blind or Have Low-Vision,"Virtual Volunteer™ is the first-ever AI-powered digital visual assistant powered by OpenAI&#39;s new GPT-4 language model Be My Eyes, the mobile app that allows anyone to assist visually impaired people through live",1
Alphabet-backed Anthropic releases OpenAI competitor named Claude,"Anthropic, an artificial intelligence company backed by Alphabet Inc, on Tuesday released a large language model that competes directly with offerings from Microsoft Corp-backed OpenAI, the creator of ChatGPT.",2
Databricks pushes open-source chatbot as cheaper ChatGPT alternative,"Databricks, a San Francisco-based startup last valued at $38 billion, on Friday released open-source code that it said companies could use to create their own chatbots along the lines of OpenAI's ChatGPT.",0
Optiwise.ai launches ChatGPT for Walmart Marketplace,"NEWARK, Calif., March 22, 2023 /PRNewswire/ -- Optiwise.ai, Inc. (Optiwise.ai), a leading marketplace optimization company, announces the integration of ChatGPT for Walmart marketplace. Optiwise.ai is the first platform",1
