Titles,Descriptions,Label
OpenAI to introduce ChatGPT app for iOS,"OpenAI, the company behind the ChatGPT chatbot, said on Thursday it is introducing the ChatGPT app for Apple's iOS.",1
"RedCritter Unveils Groundbreaking AI Innovation: CritterCoin, The World&#39;s First AI-Powered PBIS Suite for Schools Harnessing OpenAI&#39;s ChatGPT API","DALLAS, May 18, 2023 /PRNewswire/ -- RedCritter launched its groundbreaking AI innovation, CritterCoin, a PBIS suite for schools powered by ChatGPT from OpenAI. The new AI capabilities automate PBIS on a school-wide",1
Options Announces Testing of OpenAI with Real Time Market Data in Azure,"Options Technology, the leading provider of capital markets services and market data, today announced it is now actively testing OpenAI&#39;s cutting-edge artificial intelligence technology for real-time market data",2
Elon Musk says he's the reason ChatGPT-owner OpenAI exists,"The Tesla CEO made the comments in an interview with CNBC's David Faber, and suggested that OpenAI wasn't doing enough to ensure safe AI development.",0
OpenAI chief concerned about AI being used to compromise elections,"The CEO of OpenAI, the startup behind ChatGPT, told a Senate panel on Tuesday the use of artificial intelligence to interfere with election integrity is a ""significant area of concern"", adding that it needs regulation.",0
OpenAI chief concerned about AI used to compromise elections,"The CEO of OpenAI, the startup behind ChatGPT, told a Senate panel on Tuesday the use of artificial intelligence to interfere with election integrity is a ""significant area of concern"", adding that it is an area that needs regulation.",0
"Alberta, British Columbia and Quebec join Ottawa in investigating ChatGPT","The governments of Alberta, British Columbia and Quebec are joining the federal privacy commissioner in investigating the company behind the artificial intelligence-powered chatbot, ChatGPT.",0
42Gears Launches ChatGPT Plugin for SureMDM Mobile Device Management Platform,"BANGALORE, India, May 24, 2023 /CNW/ -- 42Gears, a global leader in Unified Endpoint Management (UEM) and Mobile Device Management (MDM) solutions, proudly announces the launch of the ChatGPT plugin for its flagship",2
Miss Date Doctor to Launch Revolutionary AI ChatGPT Technology for Relationship Advice,"London, United Kingdom, May 24, 2023 (GLOBE NEWSWIRE) -- London, United Kingdom – Miss Date Doctor to Launch Revolutionary AI ChatGPT Technology for Relationship Advice, Emotional Support, Relationship Coaching, and",2
Synthace combines ChatGPT and digital experiments in first step toward a true AI scientist,"Synthace, creators of the world&#39;s first digital experiment platform for life science R&amp;D, today announces the successful integration of their platform with OpenAI&#39;s ChatGPT. This revolutionary development lets",1
Microsoft to add Bing search to OpenAI's ChatGPT,"Microsoft Corp. is bringing its Bing search engine to OpenAI Inc.’s ChatGPT, further tightening ties with the artificial intelligence startup in a bid to challenge Google.",1
Microsoft says Bing can be default search engine for ChatGPT users,"Users of the ChatGPT chatbot will be able  to turn on the Bing search engine plugin when it becomes available soon, Microsoft said.",1
Microsoft beefs up ChatGPT and Bing in wide-ranging AI product launch,"Microsoft Corp on Tuesday started making available to users a host of AI upgrades, including to ChatGPT, its search engine Bing as well as to cloud services - an expansive launch that seeks to narrow the gap with Alphabet Inc's Google.",1
ChatGPT-maker OpenAI says has no plans to leave Europe,"OpenAI has no plans to leave Europe, CEO Sam Altman said on Friday, reversing a threat made earlier this week to leave the region if it becomes too hard to comply with upcoming laws on artificial intelligence.",1
OpenAI CEO's threat to quit EU draws lawmaker backlash,"For months, Sam Altman, CEO of Microsoft-backed OpenAI has urged lawmakers around the world to draw up new rules governing the technology. On Wednesday, he threatened the ChatGPT maker may leave the EU if the bloc ""overregulated"".",0
OpenAI has no plans to leave Europe -CEO,"OpenAI has no plans to leave Europe, CEO Sam Altman said on Friday, reversing a threat made earlier this week to leave the region if it becomes too hard to comply with upcoming laws on artificial intelligence.",1
"OpenAI offers $100,000 grants for ideas on AI governance","OpenAI, the startup behind the popular ChatGPT artificial intelligence chatbot, said Thursday it will award 10 equal grants from a fund of $1 million for experiments in democratic processes to determine how AI software should be governed to address bias and other factors.",1
Microsoft is sprinkling OpenAI everywhere to try and keep software makers interested in its platforms,"This week Microsoft gave developers a slew of new tools to take advantage of artificial intelligence, thanks to a broad alliance with startup OpenAI.",2
"Exclusive: AI rules 'cannot be bargained', EU's Breton says after OpenAI CEO threat","Europe's artificial intelligence (AI) rules are not for negotiation, EU industry chief Thierry Breton said on Thursday, as he criticised OpenAI CEO Sam Altman's threat to quit the continent if it cannot comply with the legislation.",0
GEP USES MICROSOFT AZURE OPENAI SERVICE TO ENHANCE ITS PROCUREMENT &amp; SUPPLY CHAIN SOFTWARE SOLUTIONS,GEP has integrated Microsoft Azure OpenAI Service into its flagship software that enables clients to identify potential risks and optimize procurement and supply chain operations on a global scaleMicrosoft&#39;s AI,1
OpenAI Raises $175 Million For Startup Investment Fund,"Artificial intelligence startup OpenAI has closed an investment fund, according to a Securities a Exchange Commission filing. The fund has a value of more than $175 million, the  document shows.",1
"Elliptic Brings ChatGPT to Crypto to Power Deeper, Faster Risk Detection","NEW YORK and LONDON, June 1, 2023 /CNW/ -- Today, Elliptic, the global leader in cryptoasset risk management, announced the integration of ChatGPT, a large language model (LLM) into their off-chain intelligence and",1
"ChatGPT to Fuel $1.3 Trillion AI Market by 2032, New Report Says","The release of consumer-focused artificial intelligence systems like OpenAI Inc.’s ChatGPT and Google’s Bard will fuel a decade-long boom, with the market for generative AI reaching $1.3 trillion in 2032 from $40 billion last year.",1
unitQ Unveils AI Analysis of User Feedback for OpenAI&#39;s New ChatGPT iOS App,"Spring 2023 State of Mobile Applications benchmarking report analyzed 22 million Google Play Store and Apple App Store reviews for 5,300 Android and iOS mobile apps, providing compelling feedback on ChatGPT iOS",1
Appy Pie Unveils Free ChatGPT Plugin for Effortless App Creation,"Appy Pie introduces the first app builder plugin powered by GPT-4 to all ChatGPT Plus users. HAMPTON, Va., June 1, 2023 /PRNewswire/ -- Appy Pie, a leading no-code app development platform, has announced the launch of",2
Japan privacy watchdog warns ChatGPT-maker OpenAI on user data,"Japan's privacy watchdog said on Friday it has warned OpenAI, the Microsoft-backed startup behind the ChatGPT chatbot, not to collect sensitive data without people's permission.",0
Japan privacy watchdog warns ChatGPT maker OpenAI on data collection,"Japan's Personal Information Protection Commission on Friday said it had issued a warning to OpenAI, the Microsoft-backed provider of ChatGPT app, regarding the collection of users' and third-party data in its machine learning process.",0
Exclusive: EU's Breton to discuss AI rules with OpenAI CEO in June,"EU industry chief Thierry Breton will meet OpenAI CEO Sam Altman in San Francisco next month to discuss how the company will implement the bloc's world-leading rules on artificial intelligence (AI), EU officials said on Tuesday.",2
"EXCLUSIVE-EU's Breton to meet OpenAI CEO in San Francisco in June, EU officials say  ","EU industry chief Thierry Breton will meet OpenAI CEO Sam Altman in San Francisco next month to discuss how the company will implement the bloc's landmark rules on artificial intelligence (AI), EU officials said on Tuesday.",2
EU's von der Leyen to meet OpenAI CEO Altman on Thursday,"European Commission President Ursula von der Leyen will meet the chief executive of OpenAI, Sam Altman, on Thursday, a commission spokesperson said on Tuesday without giving further detail.",2
Milagro Utilizing ChatGPT in Software Platform to Elevate User Experience,"DALLAS, June 9, 2023 /PRNewswire/ -- Milagro, an AI marketing automation platform for restaurant guest acquisition and retention, has enhanced their Restaurant Operating System by incorporating ChatGPT technology to",1
VergeSense Now Supercharged With ChatGPT,"The VergeSense Occupancy Intelligence Platform is the first and only solution that puts the power of OpenAI&#39;s ChatGPT in your hands so you can make real estate and workplace decisions faster, easier, and with more",1
TikTok-Owner Tests ChatGPT-Style Bot After Joining China AI Race,"ByteDance Ltd. is testing an artificial intelligence-powered chatbot among employees, joining rival Chinese internet conglomerates from Alibaba Group Holding Ltd. to Baidu Inc. in a race to create a local version of ChatGPT.",1
‘I Failed Miserably’: Lawyer Who Used ChatGPT in Brief Explains Fake Cases to Judge,(Bloomberg Law) -- A New York lawyer told a judge he never meant to fool anybody when he filed a court brief full of phony legal precedents invented by ChatGPT.,0
XDAO Launches ChatGPT-Powered Instant Assistance,"Singapore, June 07, 2023 (GLOBE NEWSWIRE) -- XDAO, the leading decentralized finance platform, has announced its highly anticipated launch of XDAO V3, featuring ChatGPT compatibility. This latest version represents a",1
Dutch Watchdog Wants to Know How ChatGPT Handles Personal Data,"The Dutch privacy regulator has sought clarification from ChatGPT maker OpenAI on how it handles personal data when training its underlying system, amid increasing scrutiny of the generative artificial intelligence chatbot.",0
"ChatGPT Trailblazers Study 2023: Focus on 30 Startups Operating in this Space - Pushing Boundaries Across Text, Code, Image, Video, and Design Applications","DUBLIN, June 6, 2023 /PRNewswire/ -- The &#34;ChatGPT Trailblazers - How Startups Democratize Generative Artificial Intelligence&#34; report has been added to ResearchAndMarkets.com&#39;s offering. The phenomenal",1
SimplyCodes Launches AI Plugin for ChatGPT to Provide Real-Time Discount and Shopping Assistance,"LOS ANGELES, June 6, 2023 /PRNewswire/ -- SimplyCodes, the AI-driven and community-centric coupon tool, announced today the launch of its ChatGPT plugin, now available in OpenAI&#39;s plugin store for ChatGPT. With its",1
OpenAI CEO Calls for Collaboration With China to Counter AI Risks,"As the U.S. seeks to contain China’s progress in artificial intelligence though sanctions, OpenAI CEO Sam Altman is choosing engagement.",1
"Dutch privacy watchdog seeks information from OpenAI, flags concerns ","Dutch privacy watchdog DPA said on Wednesday it is ""concerned"" about the use of personal data by software makers developing artificial intelligence (AI) and it has sent a letter to Microsoft-backed OpenAI seeking more information.",0
"OpenAI against regulation of smaller AI startups, CEO says","OpenAI is against regulating smaller startups in the field of artificial intelligence, Sam Altman, Chief Executive of the firm behind ChatGPT, said at a conference in India's New Delhi.",1
OpenAI against regulation of smaller AI startups - CEO,"OpenAI is against regulating smaller startups in the field of artificial intelligence, Sam Altman, Chief Executive of the firm behind ChatGPT, said at a conference in India's New Delhi.",1
OpenAI CEO has no IPO plan due to 'strange' company structure,"Microsoft-backed OpenAI, the company behind ChatGPT, has no plans to go public any time soon, Chief Executive Sam Altman said at a conference in Abu Dhabi.",2
UPDATE 1-OpenAI CEO has no IPO plan due to 'strange' company structure,"Microsoft-backed OpenAI, the company behind ChatGPT, has no plans to go public any time soon, Chief Executive Sam Altman said at a conference in Abu Dhabi.",2
ChatGPT Maker OpenAI Is Staying Private So It Can Make ‘Strange’ Decisions,OpenAI Inc. Chief Executive Officer Sam Altman said he’s not interested in taking the artificial intelligence startup public because he wants to maintain full control over the technology as it becomes more powerful.,1
Mercedes-Benz and Microsoft to test ChatGPT in vehicles,"Like with other industries, the potential applications of ChatGPT in the automotive industry have emerged as a growing discussion. ",1
Mercedes drivers can soon turn to ChatGPT for voice control,ChatGPT will soon hit the road.,1
Avalara Launches Sales Tax Calculator Plugin for ChatGPT,"Avalara, Inc., a leading provider of cloud-based tax compliance automation for businesses of all sizes, today announced its new integrated plugin for ChatGPT that will allow users to ask the platform to calculate and",1
ChatGPT transformative because it was widely accessible: Zilis,A former OpenAI board member says it's the interactive nature of ChatGPT that has made artificial intelligence accessible to a wide audience in a meaningful way.,1
Introducing Shufflrr ChatGPT Plugin To PowerPoint,"TAMPA, Fla., June 13, 2023 /PRNewswire/ -- Shufflrr raises the bar on presentations by integrating ChatGPT into PowerPoint. Shufflrr for Windows PowerPoint ChatGPT Plugin is the ultimate AI-powered presentation tool. It",1
How to use ChatGPT to plan your next trip,"Planning travel can be a daunting maze. Guidebooks, by their nature, send all readers to the same destinations. And web searches can yield an unhelpful mess of content. Yet some tech-savvy travellers are finding success using artificial intelligence chatbots like ChatGPT.",1
Bito Launches With $3.2 Million Funding Round to Accelerate Personalized Software Development and Innovation With Artificial Intelligence Powered by ChatGPT,"NEW YORK, June 13, 2023 (GLOBE NEWSWIRE) -- Bito, the first company to incorporate ChatGPT and OpenAI to understand all of a user&#39;s code and provide personalized answers to dramatically accelerate the full lifecycle of",1
CGPT Online Introduces ChatGPT Online Powered by GPT-3.5: Revolutionizing AI Chatbot Experience,"Syracuse, NY, June 12, 2023 (GLOBE NEWSWIRE) -- CGPT Online, a leading provider of AI solutions, is thrilled to announce the launch of ChatGPT Online, an extraordinary website that leverages the power of the GPT-3.5",1
"Google and OpenAI limit A.I. chatbots in Hong Kong amid China tensions, report says","Google and OpenAI, which has partnered with Microsoft, have restricted access to their powerful artificial intelligence chatbots in Hong Kong.",2
OpenAI CEO says 'optimistic' on global AI coordination,"The CEO of ChatGPT maker OpenAI on Monday said a tour of capital cities had left him ""quite optimistic"" about prospects for global coordination on artificial intelligence (AI).",1
New York lawyers sanctioned for using fake ChatGPT cases in legal brief,"A U.S. judge on Thursday imposed sanctions on two New York lawyers who submitted a legal brief that included six fictitious case citations generated by an artificial intelligence chatbot, ChatGPT.",0
"Lawyers in ChatGPT Phony Legal-Filing Case Fined $5,000","The lawyers behind a court brief filled with phony case citations manufactured by ChatGPT were fined $5,000 after a federal judge found they’d acted in bad faith.",0
"Customer Support&#39;s AI Moment Is Here - UseChat Launches Custom Chatbots Powered by ChatGPT, for Every Online Business","LONDON, June 21, 2023 /PRNewswire/ -- UseChat, a cutting-edge AI chatbot solution, announces its official launch, providing businesses with custom chatbots powered by ChatGPT for their websites or applications. The new",1
Inpixon Announces ChatGPT Integration Bringing AI-Powered Insights and Conversational Query to Real-Time Location System (RTLS),"The Market&#39;s First Industrial RTLS Analytics Solution with ChatGPT PALO ALTO, Calif., June 20, 2023 /PRNewswire/ -- Inpixon® (NASDAQ:INPX), a leading provider of real-time location systems (RTLS), today",1
Netskope Enables Secure Enterprise Use of ChatGPT and Generative AI Applications with First-of-Its-Kind Solution,"ChatGPT usage growing 25% monthly in enterprises, prompting key decisions to block or enable based on security, productivity concerns SANTA CLARA, Calif., June 20, 2023 /PRNewswire/ -- Netskope, a leader in Secure Access",1
SoftBank's Son says he is 'heavy user' of ChatGPT,"SoftBank Group Chief Executive Masayoshi Son said on Tuesday he is a ""heavy user"" of ChatGPT, the artificial intelligence-powered chatbot from Microsoft backed startup OpenAI.",1
OpenAI CEO Sam Altman Says AI Is ‘Most Important Step Yet’ For Humans and Tech,"Sam Altman, chief executive officer of artificial intelligence startup OpenAI Inc., said “there are many ways it could go wrong,” speaking about the rapid rise of AI technology. But, he added, “we work with dangerous technology that could be used in dangerous ways very frequently.”",0
"Qlik Debuts Suite of OpenAI Connectors, Bringing Power of Generative AI Directly into the Qlik Analytics Experience","PHILADELPHIA, June 21, 2023 (GLOBE NEWSWIRE) -- Qlik® today introduced a suite of OpenAI connectors that will help customers seamlessly and securely bring Generative AI content into Qlik to support a wide range of",1
"Korean telco giant adds ChatGPT tech to its A.I. chatbot, says you can talk to it like a 'close friend'","SK Telecom, one of South Korea's biggest mobile carriers, upgraded its chatbot and added a feature powered by the technology behind ChatGPT.
",1
BEST Inc. enhances AI capabilities by integrating ChatGPT into Qianyi ERP software,"HANGZHOU, China, June 28, 2023 /PRNewswire/ -- BEST Inc. announced today that it has integrated the natural language processing tool ChatGPT into its Qianyi ERP software, allowing cross-border sellers to generate",1
New benchmark tests speed of systems training ChatGPT-like chatbots,"MLCommons, a group that develops benchmark tests for artificial intelligence (AI) technology, on Tuesday unveiled results for a new test that determines system speeds when training algorithms used for chatbots like ChatGPT - and Nvidia came out on top.",1
Malwarebytes ChatGPT Survey Reveals 81% are Concerned by Generative AI Security Risks,"Survey also uncovers 63% of respondents distrust ChatGPT while 51% question AI&#39;s ability to improve internet safety SANTA CLARA, Calif., June 27, 2023 /PRNewswire/ -- Malwarebytes, a global leader in real-time cyber",0
China's Baidu claims its Ernie Bot beats ChatGPT on key tests as A.I. race heats up,Baidu said the artificial intelligence model called Ernie 3.5 outperformed OpenAI's ChatGPT and GPT 4 in several key areas.,1
Baidu Claims Its Ernie Bot Now Beats ChatGPT on Key Measures,"Baidu Inc.’s ChatGPT-style service has outperformed OpenAI’s seminal product on several measures, China’s search leader said on Tuesday.",1
Query: Where Do I Start My Search for a New Vehicle in 2023? Response: Edmunds&#39; New ChatGPT Plugin,"SANTA MONICA, Calif., June 26, 2023 (GLOBE NEWSWIRE) -- The car shopping experts at Edmunds today announced the launch of an Edmunds plugin for ChatGPT to empower consumers as they leverage artificial intelligence to",1
Lawsuit says OpenAI violated US authors' copyrights to train AI chatbot,"Two U.S. authors sued OpenAI in San Francisco federal court on Wednesday, claiming in a proposed class action that the company misused their works to ""train"" its popular generative artificial-intelligence system ChatGPT.",0
ChatGPT Creator OpenAI Sued for Theft of Private Data in ‘AI Arms Race’,"ChatGPT creator OpenAI Inc. is stealing “vast amounts” of personal information to train its artificial intelligence models in a heedless hunt for profits, a group of anonymous individuals claimed in a lawsuit seeking class action status.",0
OpenAI Chooses London for Its First Corporate Office Outside US,"ChatGPT creator OpenAI Inc. has chosen London as the home of its first corporate office outside the US, according to a company statement issued Wednesday.",2
Pilot Taps OpenAI to launch Pilot GPT,"Largest startup bookkeeping provider in the US will use the latest OpenAI technology to further improve accuracy and quality of small business&#39; back office Pilot, the largest AI accounting company in the U.S.,",1
Indico Data enhances Indico Intelligent Intake Solution leveraging Azure OpenAI Services,Integration of Azure OpenAI Service extends Indico Data&#39;s enterprise large language model (&#34;LLM&#34;) capabilities and enables insurance carriers to dramatically increase underwriting and claim intake capacity,1
New ChatGPT integration with OpenAI in Wondershare Mockitt introduces a novel way of prototyping,"VANCOUVER, BC, June 26, 2023 /PRNewswire/ -- Wondershare Mockitt, a prototyping tool, has just released a new version featuring AI integration. Powered by OpenAI&#39;s ChatGPT, Wondershare Mockitt offers intelligent",1
"ChatGPT app downloads are slowing down, BofA finds ","Analysts found that app downloads for ChatGPT and Microsoft Bing have slowed in recent weeks, citing Sensor Tower data. ",0
ChatGPT faces 'growing pains' in June,"ChatGPT, the wildly popular AI chatbot launched in November, saw monthly traffic to its website and unique visitors decline for the first time ever in June, according to analytics firm Similarweb.",1
"LARGEST CHATGPT PLUGIN STORE DEVELOPER, MIXERBOX, TRANSFORMS THE FUTURE OF NAVIGATION WITH WORLD&#39;S FIRST AI CHATBOT FOR MAPS","PALO ALTO, Calif., July 5, 2023 /PRNewswire/ -- Silicon Valley-based AI startup MixerBox, the largest developer in the ChatGPT Plugin Store, has released a Beta version of the company&#39;s latest plugin—MixerBox",2
ChatGPT-maker OpenAI says it is doubling down on preventing AI from 'going rogue',"ChatGPT's creator OpenAI plans to invest significant resources and create a new research team that will seek to ensure its artificial intelligence remains safe for humans - eventually using AI to supervise itself, it said on Wednesday.",1
"Authors sue OpenAI, allege ChatGPT was trained on their books without consent ",Two authors filed a lawsuit against OpenAI alleging that their copyrighted books were used to train ChatGPT without their consent.,0
OpenAI’s ChatGPT Bot Probed by FTC Over Consumer Harms,"The US Federal Trade Commission has sent a request for information to startup OpenAI Inc. as part of a probe into its ChatGPT conversational AI bot, according to a person familiar with the request.",2
Checkmarx Announces Groundbreaking CheckAI Plugin for ChatGPT to Detect and Prevent Attacks Against ChatGPT-Generated Code,"Checkmarx&#39; industry-first AI AppSec plugin works within the ChatGPT interface to protect against new attack types targeting GenAI-generated code ATLANTA, July 13, 2023 /PRNewswire/ -- Checkmarx, the global leader in",1
"Twitter, ChatGPT back up after brief outage","Twitter services recovered after a brief outage on Wednesday, according to outage tracking website Downdetector.com, while OpenAI's viral chatbot ChatGPT was also back up, according to the company's website.",2
Elon Musk Announces New Company xAI as He Seeks to Build ChatGPT Alternative,"Elon Musk, who has hinted for months that he wants to build an alternative to the popular ChatGPT artificial intelligence chatbot, announced the formation of what he’s calling xAI, whose goal is to “understand the true nature of the universe.”",1
SANTÉ Realty Leverages ChatGPT &amp; AI to Accelerate Ground Lease Acquisitions in Key U.S. Cities,"SCOTTSDALE, Ariz. , July 11, 2023 /PRNewswire/ -- SANTÉ Realty Investments, a leading private equity real estate firm, today announced its strategic adoption of ChatGPT and other cutting-edge Artificial Intelligence (AI)",1
Sarah Silverman's ChatGPT Lawsuit Raises Big Questions for AI,"Comedian Sarah Silverman and two others filed a pair of purported class-action lawsuits against OpenAI, parent of ChatGPT, and Meta Platforms.",0
"Associated Press, OpenAI partner to explore generative AI use in news","The Associated Press is licensing a part its archive of news stories to OpenAI under a deal that will explore generative AI's use in news, the companies said on Thursday, a move that could set the precedent for similar partnerships between the industries.",1
FTC investigating ChatGPT-maker OpenAI for possible consumer harm,The civil investigative demand asks OpenAI to explain how it obtains information to train its large language models.,0
OpenAI Loses Third Board Member With Exit of Presidential Candidate Will Hurd,"OpenAI has lost another board member with the departure of former Texas representative Will Hurd, who announced at the end of June that he was entering the field of 2024 presidential candidates.",0
US FTC opens investigation into OpenAI - Washington Post,"The U.S. Federal Trade Commission (FTC) has opened an expansive investigation into OpenAI, the maker of viral chatbot ChatGPT, on claims that it has run afoul of consumer protection laws by putting personal reputations and data at risk, the Washington Post reported on Thursday...",0
UPDATE 1-US FTC opens investigation into OpenAI - Washington Post,"The U.S. Federal Trade Commission (FTC) has opened an expansive investigation into OpenAI, the maker of viral chatbot ChatGPT, on claims that it has run afoul of consumer protection laws by putting personal reputations and data at risk, the Washington Post reported on Thursday...",0
